{
  "engagement": "ACME-CYBER-2026",
  "pack": "acme-rail-governance@1.0.0",
  "scale": "iam-0-5",
  "runs": [
    {
      "run": 1,
      "date": "2026-01-15",
      "trigger": "aggregation run"
    }
  ],
  "subjects": {
    "01_governancePolicy": {
      "final": {
        "score": 3,
        "confidence": "High",
        "ci": [
          2.079,
          3.421
        ]
      },
      "sayScore": 2,
      "doScore": 3,
      "evidence": [
        {
          "artefact": "reviews/01_governancePolicy_review.md",
          "tag": "Direct",
          "rubricLevel": 3,
          "rubricQuote": "Governance policy is applied consistently across the organisation.",
          "confidence": "High"
        },
        {
          "artefact": "reviews/02_riskFramework_review.md",
          "tag": "Indirect",
          "rubricLevel": 2,
          "rubricQuote": "A documented policy exists but its application is inconsistent.",
          "confidence": "Medium"
        }
      ],
      "history": [
        {
          "run": 1,
          "score": 3,
          "confidence": "High",
          "driver": "sets initial score 3 (High) after aggregation run"
        }
      ],
      "flag": null,
      "disputes": []
    },
    "02_riskRegister": {
      "final": {
        "score": 1,
        "confidence": "Low",
        "ci": [
          1.0,
          1.0
        ]
      },
      "sayScore": null,
      "doScore": null,
      "evidence": [
        {
          "artefact": "reviews/03_riskRegisterExtract_review.md",
          "tag": "Indirect",
          "rubricLevel": 1,
          "rubricQuote": "Risks are recorded informally with no review cycle.",
          "confidence": "Low"
        },
        {
          "artefact": "reviews/04_boardMinutes_review.md",
          "tag": "None",
          "rubricLevel": 4,
          "rubricQuote": "Not relevant to this subject.",
          "confidence": "High"
        }
      ],
      "history": [
        {
          "run": 1,
          "score": 1,
          "confidence": "Low",
          "driver": "sets initial score 1 (Low) after aggregation run"
        }
      ],
      "flag": "lowOutlier",
      "disputes": []
    },
    "03_assetData": {
      "final": {
        "score": null,
        "confidence": null,
        "ci": null
      },
      "sayScore": null,
      "doScore": null,
      "evidence": [],
      "history": [],
      "flag": null,
      "disputes": []
    }
  }
}
